{
  "version": 2.0,
  "success": true,
  "reason": null,
  "content": {
    "device": {
      "activation_code": null,
      "activation_code_expiry_time": "2024-04-22T19:31:18.358Z",
      "appliance_name": null,
      "appliance_uuid": null,
      "auto_scaling_group_name": null,
      "av_ave_version": null,
      "av_engine": null,
      "av_last_scan_time": null,
      "av_pack_version": null,
      "av_product_version": null,
      "av_vdf_version": null,
      "cloud_provider_account_id": null,
      "cloud_provider_resource_id": null,
      "cluster_name": null,
      "compliance_status": "NOT_ASSESSED",
      "current_sensor_policy_name": "Standard",
      "datacenter_name": null,
      "deployment_type": "ENDPOINT",
      "deregistered_time": null,
      "device_meta_data_item_list": [
        {
          "key_name": "OS_MAJOR_VERSION",
          "key_value": "Windows 11",
          "position": 0
        },
        {
          "key_name": "SUBNET",
          "key_value": "9.30.43.0",
          "position": 0
        }
      ],
      "email": "Administrator",
      "esx_host_name": null,
      "esx_host_uuid": null,
      "first_name": null,
      "infrastructure_provider": "NONE",
      "last_contact_time": "2024-05-10T17:31:19.521Z",
      "last_device_policy_changed_time": null,
      "last_device_policy_requested_time": "2024-05-10T17:06:42.474Z",
      "last_internal_ip_address": "9.35.43.10",
      "last_external_ip_address": "70.25.23.23",
      "last_location": "OFFSITE",
      "last_policy_updated_time": "2023-12-13T07:03:23.711Z",
      "last_name": null,
      "last_reported_time": "2024-05-10T17:11:52.177Z",
      "last_reset_time": null,
      "last_shutdown_time": "2024-05-10T17:06:03.515Z",
      "login_user_name": "WINSERVER2022\\Administrator",
      "mac_address": "00000a0b67eb",
      "middle_name": null,
      "name": "winserver2022",
      "nsx_distributed_firewall_policy": null,
      "organization_name": "myorg.com",
      "os": "WINDOWS",
      "os_version": "Windows Server 2022 x64",
      "policy_name": "Standard",
      "registered_time": "2024-05-10T16:59:59.563Z",
      "scan_last_action_time": null,
      "scan_last_complete_time": null,
      "scan_status": null,
      "sensor_kit_type": "WINDOWS",
      "sensor_version": "4.0.1.1428",
      "status": "REGISTERED",
      "sensor_gateway_url": null,
      "sensor_gateway_uuid": null,
      "target_priority": "MEDIUM",
      "uninstall_code": "XXXX",
      "vcenter_host_url": null,
      "vcenter_name": null,
      "vcenter_uuid": null,
      "virtual_private_cloud_id": null,
      "virtualization_provider": "OTHER",
      "vm_ip": null,
      "vm_uuid": null,
      "vm_name": null,
      "vulnerability_severity": "IMPORTANT",
      "vdi_provider": "NONE",
      "windows_platform": null,
      "sensor_states": [
        "ACTIVE",
        "LIVE_RESPONSE_NOT_RUNNING",
        "LIVE_RESPONSE_NOT_KILLED",
        "LIVE_RESPONSE_DISABLED",
        "CB_FIREWALL_INACTIVE"
      ],
      "cloud_provider_tags": [],
      "av_status": [
        "AV_ACTIVE",
        "ONDEMAND_SCAN_DISABLED"
      ],
      "av_update_servers": null,
      "vulnerability_score": 8.8,
      "id": 210476652,
      "ad_group_id": 0,
      "organization_id": 72676,
      "policy_id": 493371,
      "device_owner_id": 16421859,
      "golden_device_id": null,
      "vdi_base_device": null,
      "passive_mode": false,
      "nsx_enabled": null,
      "golden_device": null,
      "base_device": null,
      "av_master": false,
      "virtual_machine": false,
      "sensor_out_of_date": false,
      "sensor_pending_update": false,
      "policy_override": false,
      "quarantined": false,
      "asset_group": []
    }
  },
  "raw": null,
  "inputs": {
    "vmware_cbc_device_id": "210476652"
  },
  "metrics": {
    "version": "1.0",
    "package": "fn-vmware-cbc",
    "package_version": "1.0.0",
    "host": "my.app.host",
    "execution_time_ms": 15881,
    "timestamp": "2024-05-10 13:34:09"
  }
}